{
  "pack_id": "CORE",
  "pack_name": "Core Negotiation Strategies",
  "pack_version": "0.1.0",
  "schema_version": "2025-12-v1",
  "taxonomy_version": "taxonomy-2025-12-v1",
  "description": "Domain-general strategy library for negot. Contains 30 foundational strategies across setup, information, value creation/claiming, communication, deadlock, multi-party, and risk control.",
  "author": "negot",
  "compatibility": {
    "min_app_version": "0.1.0"
  },
  "domains": [
    "GENERAL"
  ],
  "strategies": [
    {
      "strategy_id": "STRAT_ANCHOR_JUSTIFY",
      "path": "strategies/STRAT_ANCHOR_JUSTIFY.json",
      "enabled": true
    },
    {
      "strategy_id": "STRAT_BRACKET_RANGE",
      "path": "strategies/STRAT_BRACKET_RANGE.json",
      "enabled": true
    },
    {
      "strategy_id": "STRAT_CONCESSION_DISCIPLINE",
      "path": "strategies/STRAT_CONCESSION_DISCIPLINE.json",
      "enabled": true
    },
    {
      "strategy_id": "STRAT_CONCESSION_PATTERNING",
      "path": "strategies/STRAT_CONCESSION_PATTERNING.json",
      "enabled": true
    },
    {
      "strategy_id": "STRAT_MESO_PACKAGES",
      "path": "strategies/STRAT_MESO_PACKAGES.json",
      "enabled": true
    },
    {
      "strategy_id": "STRAT_CONTINGENT_AGREEMENT",
      "path": "strategies/STRAT_CONTINGENT_AGREEMENT.json",
      "enabled": true
    },
    {
      "strategy_id": "STRAT_OBJECTIVE_CRITERIA",
      "path": "strategies/STRAT_OBJECTIVE_CRITERIA.json",
      "enabled": true
    },
    {
      "strategy_id": "STRAT_CALIBRATED_QUESTIONS",
      "path": "strategies/STRAT_CALIBRATED_QUESTIONS.json",
      "enabled": true
    },
    {
      "strategy_id": "STRAT_AUTHORITY_PROBE",
      "path": "strategies/STRAT_AUTHORITY_PROBE.json",
      "enabled": true
    },
    {
      "strategy_id": "STRAT_CONSTRAINT_MINING",
      "path": "strategies/STRAT_CONSTRAINT_MINING.json",
      "enabled": true
    },
    {
      "strategy_id": "STRAT_INTERESTS_BEHIND_POSITIONS",
      "path": "strategies/STRAT_INTERESTS_BEHIND_POSITIONS.json",
      "enabled": true
    },
    {
      "strategy_id": "STRAT_LABEL_EMOTIONS",
      "path": "strategies/STRAT_LABEL_EMOTIONS.json",
      "enabled": true
    },
    {
      "strategy_id": "STRAT_MIRRORING",
      "path": "strategies/STRAT_MIRRORING.json",
      "enabled": true
    },
    {
      "strategy_id": "STRAT_ACCUSATION_AUDIT",
      "path": "strategies/STRAT_ACCUSATION_AUDIT.json",
      "enabled": true
    },
    {
      "strategy_id": "STRAT_SUMMARIZE_VALIDATE",
      "path": "strategies/STRAT_SUMMARIZE_VALIDATE.json",
      "enabled": true
    },
    {
      "strategy_id": "STRAT_REFUSE_WITH_ALTERNATIVES",
      "path": "strategies/STRAT_REFUSE_WITH_ALTERNATIVES.json",
      "enabled": true
    },
    {
      "strategy_id": "STRAT_REFRAME_NO_TO_HOW",
      "path": "strategies/STRAT_REFRAME_NO_TO_HOW.json",
      "enabled": true
    },
    {
      "strategy_id": "STRAT_GO_TO_BALCONY",
      "path": "strategies/STRAT_GO_TO_BALCONY.json",
      "enabled": true
    },
    {
      "strategy_id": "STRAT_SINGLE_TEXT_PROCESS",
      "path": "strategies/STRAT_SINGLE_TEXT_PROCESS.json",
      "enabled": true
    },
    {
      "strategy_id": "STRAT_COALITION_BUILDING",
      "path": "strategies/STRAT_COALITION_BUILDING.json",
      "enabled": true
    },
    {
      "strategy_id": "STRAT_SEQUENCE_STAKEHOLDERS",
      "path": "strategies/STRAT_SEQUENCE_STAKEHOLDERS.json",
      "enabled": true
    },
    {
      "strategy_id": "STRAT_INTRODUCE_NEW_ISSUE",
      "path": "strategies/STRAT_INTRODUCE_NEW_ISSUE.json",
      "enabled": true
    },
    {
      "strategy_id": "STRAT_RISK_ALLOCATION_REDRAFT",
      "path": "strategies/STRAT_RISK_ALLOCATION_REDRAFT.json",
      "enabled": true
    },
    {
      "strategy_id": "STRAT_NIBBLE_CLOSE",
      "path": "strategies/STRAT_NIBBLE_CLOSE.json",
      "enabled": true
    },
    {
      "strategy_id": "STRAT_DEFER_AND_SCHEDULE",
      "path": "strategies/STRAT_DEFER_AND_SCHEDULE.json",
      "enabled": true
    },
    {
      "strategy_id": "STRAT_WALKAWAY_CLEAN",
      "path": "strategies/STRAT_WALKAWAY_CLEAN.json",
      "enabled": true
    },
    {
      "strategy_id": "STRAT_TIME_LEVERAGE",
      "path": "strategies/STRAT_TIME_LEVERAGE.json",
      "enabled": true
    },
    {
      "strategy_id": "STRAT_PROCESS_AGENDA_CONTROL",
      "path": "strategies/STRAT_PROCESS_AGENDA_CONTROL.json",
      "enabled": true
    },
    {
      "strategy_id": "STRAT_BRIDGE_TO_YES",
      "path": "strategies/STRAT_BRIDGE_TO_YES.json",
      "enabled": true
    },
    {
      "strategy_id": "STRAT_DECISION_CRITERIA_AGREEMENT",
      "path": "strategies/STRAT_DECISION_CRITERIA_AGREEMENT.json",
      "enabled": true
    }
  ],
  "rubrics": [
    {
      "rubric_id": "RUBRIC_MESSAGE_QUALITY",
      "path": "rubrics/RUBRIC_MESSAGE_QUALITY.json"
    },
    {
      "rubric_id": "RUBRIC_NEGOTIATION_SAFETY",
      "path": "rubrics/RUBRIC_NEGOTIATION_SAFETY.json"
    }
  ],
  "locales": [
    "en-GB"
  ],
  "license_notice": "Internal content pack for negot; bibliography references are informational only."
}
